{
  "version": 1,
  "pairing_id": "pair-fixture-001",
  "machine_name": "example-mac",
  "host": "192.0.2.10",
  "port": 22,
  "username": "developer",
  "host_key_fingerprint": "SHA256:AAAAAAAAAAAAAAAAAAAAAAAAAAAAAAAAAAAAAAAAAAA",
  "expires_at_unix": 1700000300,
  "ephemeral_private_key": "d38T7zjbGpQh1uat84ZP5B6OfdHoqc/6nNafXwe4Tb8="
}
